{
  "$schema": "https://json-schema.org/draft/2020-12/schema",
  "type": "object",
  "required": [
    "schema_version",
    "candidate_set_id",
    "authorization_id",
    "state",
    "generated_by",
    "source_revision",
    "platform",
    "manifest_sha256",
    "generated_at",
    "candidates"
  ],
  "properties": {
    "schema_version": { "const": 1 },
    "candidate_set_id": { "type": "string", "pattern": "^[a-z0-9][a-z0-9._-]+$" },
    "authorization_id": { "type": "string", "pattern": "^[a-z0-9][a-z0-9._-]+$" },
    "state": { "const": "candidates_written" },
    "generated_by": {
      "type": "object",
      "required": ["actor_id", "command"],
      "additionalProperties": false,
      "properties": {
        "actor_id": { "type": "string", "minLength": 1 },
        "command": { "const": "npm run browser:visual:update" }
      }
    },
    "source_revision": { "type": "string", "pattern": "^[a-f0-9]{40}$" },
    "platform": { "enum": ["win32", "linux"] },
    "manifest_sha256": { "type": "string", "pattern": "^[a-f0-9]{64}$" },
    "generated_at": {
      "type": "string",
      "pattern": "^\\d{4}-\\d{2}-\\d{2}T\\d{2}:\\d{2}:\\d{2}(?:\\.\\d{3})?Z$"
    },
    "candidates": {
      "type": "array",
      "minItems": 6,
      "maxItems": 6,
      "items": {
        "type": "object",
        "required": ["scenario_id", "path", "sha256"],
        "additionalProperties": false,
        "properties": {
          "scenario_id": { "type": "string" },
          "path": { "type": "string" },
          "sha256": { "type": "string", "pattern": "^[a-f0-9]{64}$" }
        }
      }
    }
  },
  "additionalProperties": false
}
