{
  "schema_version": 1,
  "candidate_set_id": "c16f02feafc67ac6caa57b6c7023bdd8",
  "authorization_id": "win32-curvature-v2-7620751-20260922",
  "state": "candidates_written",
  "generated_by": {
    "actor_id": "visual-update",
    "command": "npm run browser:visual:update"
  },
  "source_revision": "762075140dc02ef1573e28fdec896b7a0986b1ae",
  "platform": "win32",
  "manifest_sha256": "ffac5b6e527ca4053a14fd1d683a843a98d3e113265c02d8b1386b050a604d7d",
  "generated_at": "2026-09-23T01:49:20.168Z",
  "candidates": [
    {
      "scenario_id": "landing",
      "path": "apps/dashboard-e2e/src/quality/snapshots/win32/chromium/landing.png",
      "sha256": "ffd2603e95de642e80554059756d743fe388720c8a6787eb9734b58dcd8ce8dd"
    },
    {
      "scenario_id": "ticker-desktop",
      "path": "apps/dashboard-e2e/src/quality/snapshots/win32/chromium/ticker-desktop.png",
      "sha256": "42e7b8203007a469fa847656098253838ed4a50eba5057a24eb208648a9ff175"
    },
    {
      "scenario_id": "ticker-offline-mobile",
      "path": "apps/dashboard-e2e/src/quality/snapshots/win32/chromium/ticker-offline-mobile.png",
      "sha256": "6aef0610c00c8314c8aec1b5ca014f75bbec9bcbcc2373e64eaa4de8f4cf9291"
    },
    {
      "scenario_id": "positions-dense",
      "path": "apps/dashboard-e2e/src/quality/snapshots/win32/chromium/positions-dense.png",
      "sha256": "d39d97f4e7976496650177a7e997857f9c6bc08906d6f9af2733996544054211"
    },
    {
      "scenario_id": "scanner-dense",
      "path": "apps/dashboard-e2e/src/quality/snapshots/win32/chromium/scanner-dense.png",
      "sha256": "ec1ba3e283517a0824d2c406fd7cff6c0ed614b018b79b69c2de54d73851c516"
    },
    {
      "scenario_id": "ai-recommendation",
      "path": "apps/dashboard-e2e/src/quality/snapshots/win32/chromium/ai-recommendation.png",
      "sha256": "f84bace1d768caf1b2fae062b1d93e2a46d93c57e3bb88cbdd99bfdff7940737"
    }
  ]
}
