{
  "schema_version": 1,
  "candidate_set_id": "e2a1eea5690ec3f68ac293c384ec5f39",
  "authorization_id": "win32-curvature-v2-bdb93b9-20260908",
  "state": "candidates_written",
  "generated_by": {
    "actor_id": "visual-update",
    "command": "npm run browser:visual:update"
  },
  "source_revision": "bdb93b9b9076a4bce4ada9e170a55f0bec7d6b3b",
  "platform": "win32",
  "manifest_sha256": "ffac5b6e527ca4053a14fd1d683a843a98d3e113265c02d8b1386b050a604d7d",
  "generated_at": "2026-09-08T23:04:39.484Z",
  "candidates": [
    {
      "scenario_id": "landing",
      "path": "apps/dashboard-e2e/src/quality/snapshots/win32/chromium/landing.png",
      "sha256": "dcd5af69caaab82f2d9e06165cf268aec82b43a52cd7578d92c6380558f6c2e8"
    },
    {
      "scenario_id": "ticker-desktop",
      "path": "apps/dashboard-e2e/src/quality/snapshots/win32/chromium/ticker-desktop.png",
      "sha256": "a7542ea13521aaf545ad5dd7c33321834b4f65b84b272d8c28286d22f4334def"
    },
    {
      "scenario_id": "ticker-offline-mobile",
      "path": "apps/dashboard-e2e/src/quality/snapshots/win32/chromium/ticker-offline-mobile.png",
      "sha256": "04517b4c6e21b3ded6ea71327d8165ba692791085c0d4e6d19c5f54bbb986ac5"
    },
    {
      "scenario_id": "positions-dense",
      "path": "apps/dashboard-e2e/src/quality/snapshots/win32/chromium/positions-dense.png",
      "sha256": "59ba1436fb3d7d5c38e7f671c3290137ac13ce8722bd2f556e58d2ac42f8c750"
    },
    {
      "scenario_id": "scanner-dense",
      "path": "apps/dashboard-e2e/src/quality/snapshots/win32/chromium/scanner-dense.png",
      "sha256": "dcd1ca53541dadfb34dca632252eb00d020a518fd74f2e3c241fb356de9074c8"
    },
    {
      "scenario_id": "ai-recommendation",
      "path": "apps/dashboard-e2e/src/quality/snapshots/win32/chromium/ai-recommendation.png",
      "sha256": "abe4f38480153d8189e8c7ebe286c9874b81921dd2e8bfb0b7305a1c43040a48"
    }
  ]
}
