{
  "schema_version": 1,
  "candidate_set_id": "d17dbe482e69d0166176734a6f2a3149",
  "authorization_id": "linux-curvature-v2-7620751-20260922",
  "state": "candidates_written",
  "generated_by": {
    "actor_id": "visual-update",
    "command": "npm run browser:visual:update"
  },
  "source_revision": "762075140dc02ef1573e28fdec896b7a0986b1ae",
  "platform": "linux",
  "manifest_sha256": "bd5954b0ac28258a33ffdf970cb71e7afef769ec496ee8db46f3fcb34fffcc32",
  "generated_at": "2026-09-23T01:51:31.511Z",
  "candidates": [
    {
      "scenario_id": "landing",
      "path": "apps/dashboard-e2e/src/quality/snapshots/linux/chromium/landing.png",
      "sha256": "d22a0387d6edf26416fc9a8b4b055f1244f9a810726650401684053c08fd288a"
    },
    {
      "scenario_id": "ticker-desktop",
      "path": "apps/dashboard-e2e/src/quality/snapshots/linux/chromium/ticker-desktop.png",
      "sha256": "5b10208026b62fc8fa86230dc443bf674184fc73dec99bec0f0565b7fb5d914c"
    },
    {
      "scenario_id": "ticker-offline-mobile",
      "path": "apps/dashboard-e2e/src/quality/snapshots/linux/chromium/ticker-offline-mobile.png",
      "sha256": "05ec3e4c98ec2216fa958dd4e6e1ef34179e136ff109b069d080f9ff3aba8806"
    },
    {
      "scenario_id": "positions-dense",
      "path": "apps/dashboard-e2e/src/quality/snapshots/linux/chromium/positions-dense.png",
      "sha256": "d7609f61da0624ed79c9c4e3b580ea291af6e355c406a16e31d7773c9675f687"
    },
    {
      "scenario_id": "scanner-dense",
      "path": "apps/dashboard-e2e/src/quality/snapshots/linux/chromium/scanner-dense.png",
      "sha256": "acbd7057aaee6ee3631b17e8f846c318e7740176e63db4481b6451ae725e0ee4"
    },
    {
      "scenario_id": "ai-recommendation",
      "path": "apps/dashboard-e2e/src/quality/snapshots/linux/chromium/ai-recommendation.png",
      "sha256": "1aa03cd82b712c913989dadcaa19e5f5f00e70fac253deb100fa5e80556139e4"
    }
  ]
}
